Script started on 2026-08-28 13:44:05+08:00 [COMMAND="rtk lsusb -d cafe:0001 -v" <not executed on terminal>]

Bus 001 Device 023: ID cafe:0001 HC32 HC32 Boot Recovery Updater
Device Descriptor:
  bLength                18
  bDescriptorType         1
  bcdUSB               2.10
  bDeviceClass            0 [unknown]
  bDeviceSubClass         0 [unknown]
  bDeviceProtocol         0 
  bMaxPacketSize0        64
  idVendor           0xcafe HC32
  idProduct          0x0001 HC32 Boot Recovery Updater
  bcdDevice            0.01
  iManufacturer           1 HC32
  iProduct                2 HC32 Boot Recovery Updater
  iSerial                 3 HC32F460-55463233FF035043FFFF7309
  bNumConfigurations      1
  Configuration Descriptor:
    bLength                 9
    bDescriptorType         2
    wTotalLength       0x0020
    bNumInterfaces          1
    bConfigurationValue     1
    iConfiguration          0 
    bmAttributes         0x80
      (Bus Powered)
    MaxPower              100mA
    Interface Descriptor:
      bLength                 9
      bDescriptorType         4
      bInterfaceNumber        0
      bAlternateSetting       0
      bNumEndpoints           2
      bInterfaceClass       255 Vendor Specific Class
      bInterfaceSubClass      0 [unknown]
      bInterfaceProtocol      0 
      iInterface              4 Vendor Bulk Firmware Update
      Endpoint Descriptor:
        bLength                 7
        bDescriptorType         5
        bEndpointAddress     0x81  EP 1 IN
        bmAttributes            2
          Transfer Type            Bulk
          Synch Type               None
          Usage Type               Data
        wMaxPacketSize     0x0040  1x 64 bytes
        bInterval               0
      Endpoint Descriptor:
        bLength                 7
        bDescriptorType         5
        bEndpointAddress     0x02  EP 2 OUT
        bmAttributes            2
          Transfer Type            Bulk
          Synch Type               None
          Usage Type               Data
        wMaxPacketSize     0x0040  1x 64 bytes
        bInterval               0
Binary Object Store Descriptor:
  bLength                 5
  bDescriptorType        15
  wTotalLength       0x0021
  bNumDeviceCaps          1
  Platform Device Capability:
    bLength                28
    bDescriptorType        16
    bDevCapabilityType      5
    bReserved               0
    PlatformCapabilityUUID    {d8dd60df-4589-4cc7-9cd2-659d9e648a9f}
    CapabilityData[0]    0x00
    CapabilityData[1]    0x00
    CapabilityData[2]    0x03
    CapabilityData[3]    0x06
    CapabilityData[4]    0xa2
    CapabilityData[5]    0x00
    CapabilityData[6]    0x20
    CapabilityData[7]    0x00
Device Status:     0x0000
  (Bus Powered)

Script done on 2026-08-28 13:44:05+08:00 [COMMAND_EXIT_CODE="0"]
