Script started on 2026-08-27 12:38:44+08:00 [COMMAND="rtk python3 Tools/host/usb_loopback.py descriptors" <not executed on terminal>]

Bus 001 Device 012: ID fffe:ffff HC32 Phase 4 Lab CherryUSB Vendor Bulk Loopback
Device Descriptor:
  bLength                18
  bDescriptorType         1
  bcdUSB               2.00
  bDeviceClass            0 [unknown]
  bDeviceSubClass         0 [unknown]
  bDeviceProtocol         0 
  bMaxPacketSize0        64
  idVendor           0xfffe HC32 Phase 4 Lab
  idProduct          0xffff CherryUSB Vendor Bulk Loopback
  bcdDevice            0.01
  iManufacturer           1 HC32 Phase 4 Lab
  iProduct                2 CherryUSB Vendor Bulk Loopback
  iSerial                 3 HC32F460-PHASE4-0001
  bNumConfigurations      1
  Configuration Descriptor:
    bLength                 9
    bDescriptorType         2
    wTotalLength       0x0020
    bNumInterfaces          1
    bConfigurationValue     1
    iConfiguration          0 
    bmAttributes         0x80
      (Bus Powered)
    MaxPower              100mA
    Interface Descriptor:
      bLength                 9
      bDescriptorType         4
      bInterfaceNumber        0
      bAlternateSetting       0
      bNumEndpoints           2
      bInterfaceClass       255 Vendor Specific Class
      bInterfaceSubClass      0 [unknown]
      bInterfaceProtocol      0 
      iInterface              4 Vendor Bulk Loopback
      Endpoint Descriptor:
        bLength                 7
        bDescriptorType         5
        bEndpointAddress     0x81  EP 1 IN
        bmAttributes            2
          Transfer Type            Bulk
          Synch Type               None
          Usage Type               Data
        wMaxPacketSize     0x0040  1x 64 bytes
        bInterval               0
      Endpoint Descriptor:
        bLength                 7
        bDescriptorType         5
        bEndpointAddress     0x02  EP 2 OUT
        bmAttributes            2
          Transfer Type            Bulk
          Synch Type               None
          Usage Type               Data
        wMaxPacketSize     0x0040  1x 64 bytes
        bInterval               0
Device Status:     0x0000
  (Bus Powered)

Script done on 2026-08-27 12:38:44+08:00 [COMMAND_EXIT_CODE="0"]
